{
  "name": "confluence",
  "domain": "knowledge",
  "commands": {
    "health":   null,
    "search":   null,
    "read":     null,
    "create":   null,
    "update":   null,
    "discover": null
  },
  "env": [
    {"name": "CONFLUENCE_BASE_URL", "required": true,  "description": "Confluence base URL"},
    {"name": "CONFLUENCE_EMAIL",    "required": true,  "description": "User email"},
    {"name": "CONFLUENCE_API_TOKEN","required": true,  "description": "API token"}
  ],
  "outputs": {"format": "markdown", "path": ".ai-sdlc/adapter-out/"}
}
